{
  "originFile": "/home/realme-book/Project/code/prisma-field-omitter/test/cli-tmp/input/types.ts",
  "outputDir": "/home/realme-book/Project/code/prisma-field-omitter/test/cli-tmp/output",
  "deleteOriginFile": false,
  "action": "delete",
  "generateOmitTypes": false,
  "hide": [
    {
      "field": [
        "*At",
        "password",
        "*Id"
      ],
      "target": [
        "*Input",
        "User"
      ],
      "on": "both"
    }
  ]
}