{
  "originFile": "test/cli-tmp/input/types.ts",
  "outputDir": "/home/realme-book/Project/code/prisma-field-omitter/test/cli-tmp/output",
  "deleteOriginFile": false,
  "action": "comment",
  "generateOmitTypes": false,
  "hide": [
    {
      "field": "*At",
      "target": "all",
      "on": "both"
    }
  ]
}