{
  "originFile": "./examples/big-index.d.ts",
  "outputDir": "./examples/output",
  "deleteOriginFile": false,
  "action": "delete",
  "generateOmitTypes": true,
  "generatedOmitTypesOutputPath": "./examples/output/omit-types.ts",
  "hide": [
    {
      "field": [
        "*Id"
      ],
      "target": "all",
      "on": "both"
    }
  ]
}