{
  "$schema": "src/prisma-field-omitter.schema.json",
  "originFile": ["prisma/**/*.input.ts", "prisma/**/*.output.ts"],
  "outputDir": "prisma/processed",
  "deleteOriginFile": false,
  "action": "comment",
  "generateOmitTypes": false,
  "generatedOmitTypesOutputPath": "prisma/omit.types.ts",
  "hide": [
    {
      "field": "*At",
      "target": "all",
      "on": "input"
    },
    {
      "field": ["isActive", "type"],
      "target": ["User*Input", "Post*Input"],
      "on": "input"
    },
    {
      "field": "user",
      "target": ["create", "update"]
    },
    {
      "field": ["include", "upsert", "disconnect", "delete"],
      "target": ["UserMeta*UserNestedInput", "Post*UserNestedInput"]
    }
  ]
}
